Book_id,Book_name,Publication_date,Category_id,Author_id,Language,Book_description
3168,Introduction to Art History,2018-08-10,5041,1036,German,"An overview of major periods, movements, and artists in art history."
3169,Modern Art,2020-12-15,5126,1036,Russian,A detailed exploration of the major movements and artists in modern art.
3170,Introduction to Philosophy,2019-05-20,5133,1037,French,An overview of major philosophical concepts and thinkers from ancient to modern times.
3171,Ethics and Morality,2021-09-30,5136,1037,Chinese,This book explores the foundations of ethics and moral philosophy.
3172,Introduction to Anthropology,2020-02-15,5061,1038,Chinese,"An overview of the field of anthropology, covering cultural, social, and biological aspects of human societies."
3173,Cultural Anthropology,2022-07-25,5063,1038,Russian,"A detailed exploration of cultural anthropology, including kinship, religion, and economic systems."
3174,Introduction to Linguistics,2018-11-20,5022,1039,English,An introductory text covering the fundamental concepts and theories in linguistics.
3175,Sociolinguistics,2021-06-10,5005,1039,Italian,This book explores the relationship between language and society.
3176,Introduction to Astronomy,2019-01-30,5025,1040,German,"An overview of the field of astronomy, covering celestial objects and phenomena."
3177,Astrophysics,2021-12-20,5026,1040,French,A detailed exploration of the principles of astrophysics.
3178,Introduction to History,2019-04-25,5107,1041,German,An overview of major historical events and periods from ancient to modern times.
3179,Modern World History,2021-08-30,5037,1041,Chinese,This book covers major events in modern world history.
3180,Introduction to Business,2018-06-20,5090,1042,German,An introductory text covering the fundamental principles and concepts in business.
3181,Business Ethics,2020-12-10,5024,1042,Spanish,A comprehensive guide to ethical practices in the business world.
3182,Introduction to Education,2019-07-12,5129,1043,Hebrew,"An overview of the field of education, covering theories, practices, and policies."
3183,Educational Psychology,2021-02-28,5013,1043,Russian,This book explores the psychological principles of learning and teaching.
3184,Introduction to Engineering,2018-09-05,5094,1044,Hindi,An introductory text covering the fundamental principles and concepts in engineering.
3185,Mechanical Engineering,2020-03-25,5051,1044,Hindi,A detailed exploration of the principles and applications of mechanical engineering.
3186,Introduction to Environmental Science,2019-05-15,5015,1045,Spanish,"An introductory text on environmental science, covering ecosystems, biodiversity, and pollution."
3187,Sustainable Development,2021-08-20,5072,1045,German,This book explores the principles and practices of sustainable development.
3188,Introduction to Philosophy,2018-11-25,5133,1046,Hindi,An overview of major philosophical concepts and thinkers from ancient to modern times.
3189,Metaphysics,2020-07-10,5108,1046,French,A comprehensive guide to the principles and debates in metaphysics.
3190,Introduction to Political Science,2019-03-30,5006,1047,Chinese,An introductory text covering the basic concepts and theories in political science.
3191,International Relations,2021-11-25,5030,1047,German,This book explores the major theories and issues in international relations.
3192,Introduction to Sociology,2018-05-22,5048,1048,French,An introductory book that covers the basic concepts and theories in sociology.
3193,Urban Sociology,2020-09-10,5069,1048,Hindi,This book examines the development and structure of cities and urban life.
3194,Introduction to Psychology,2019-02-20,5020,1049,Russian,An overview of the major concepts and theories in psychology.
3195,Developmental Psychology,2021-06-15,5132,1049,Hebrew,This book explores human development across the lifespan.
3196,Introduction to Economics,2018-11-05,5089,1050,Japanese,An overview of economic principles and concepts.
3197,Microeconomics,2020-08-20,5166,1050,Italian,This book explores the principles of microeconomics.
3198,Introduction to History,2019-05-30,5107,1051,English,An overview of major historical events and periods.
3199,Medieval History,2021-09-05,5007,1051,Spanish,This book explores the history of the medieval period.
3200,Introduction to Chemistry,2018-10-10,5161,1052,Chinese,An overview of the basic principles and concepts in chemistry.
3201,Physical Chemistry,2020-12-15,5058,1052,Russian,A detailed exploration of the principles of physical chemistry.
3202,Introduction to Business,2019-03-25,5090,1053,Hebrew,An introductory text covering the fundamental principles and concepts in business.
3203,Business Management,2021-07-05,5079,1053,Japanese,This book explores the principles and practices of business management.
3204,Introduction to Engineering,2018-06-15,5094,1054,Italian,An introductory text covering the fundamental principles and concepts in engineering.
3205,Electrical Engineering,2020-11-22,5150,1054,Hebrew,A detailed exploration of the principles and applications of electrical engineering.
3206,Introduction to Environmental Science,2019-02-18,5015,1055,Hebrew,"An introductory book on environmental science, covering ecosystems, biodiversity, and pollution."
3207,Environmental Policy,2021-06-25,5059,1055,Japanese,This book examines environmental policies and regulations.
3208,Introduction to Art History,2018-09-12,5041,1056,French,"An overview of major periods, movements, and artists in art history."
3209,Contemporary Art,2020-12-20,5128,1056,Spanish,A detailed exploration of the major movements and artists in contemporary art.
3210,Introduction to Philosophy,2019-04-15,5133,1057,Spanish,An overview of major philosophical concepts and thinkers from ancient to modern times.
3211,Philosophy of Science,2021-10-05,5121,1057,Italian,This book explores the philosophical foundations of science.
3212,Introduction to Anthropology,2019-06-20,5061,1058,German,"An overview of the field of anthropology, covering cultural, social, and biological aspects of human societies."
3213,Archaeology,2021-09-30,5174,1058,Hebrew,This book covers the principles and methods of archaeology.
3214,Introduction to Linguistics,2018-11-22,5022,1059,Russian,An introductory text covering the fundamental concepts and theories in linguistics.
3215,Psycholinguistics,2021-07-18,5003,1059,Italian,This book examines the psychological processes underlying language.
3216,Introduction to Astronomy,2019-04-10,5025,1060,French,"An overview of the field of astronomy, covering celestial objects and phenomena."
3217,Observational Astronomy,2021-12-22,5012,1060,Spanish,This book covers the methods and techniques used in observational astronomy.
3218,Introduction to History,2019-01-12,5107,1061,Japanese,An overview of major historical events and periods.
3219,History of the Middle East,2021-06-25,5027,1061,Hindi,This book explores the history of the Middle East.
3220,Introduction to Business,2018-03-25,5090,1062,French,An introductory text covering the fundamental principles and concepts in business.
3221,Marketing Principles,2020-09-10,5032,1062,Russian,This book explores the fundamental principles and strategies in marketing.
3222,Introduction to Education,2019-05-05,5129,1063,Hebrew,"An overview of the field of education, covering theories, practices, and policies."
3223,Curriculum Design,2021-08-20,5083,1063,Spanish,This book explores the principles and practices of curriculum design.
3224,Introduction to Engineering,2018-04-15,5094,1064,Italian,An introductory text covering the fundamental principles and concepts in engineering.
3225,Civil Engineering,2020-10-05,5117,1064,German,A detailed exploration of the principles and applications of civil engineering.
3226,Introduction to Environmental Science,2019-07-18,5015,1065,Italian,"An introductory book on environmental science, covering ecosystems, biodiversity, and pollution."
3227,Environmental Chemistry,2021-12-15,5145,1065,Hindi,This book explores the chemical principles and processes in the environment.
3228,Introduction to Philosophy,2018-09-25,5133,1066,Italian,An overview of major philosophical concepts and thinkers from ancient to modern times.
3229,Philosophy of Mind,2020-12-10,5073,1066,Spanish,A comprehensive guide to the principles and debates in the philosophy of mind.
3230,Introduction to Sociology,2019-03-10,5048,1067,Japanese,An introductory book that covers the basic concepts and theories in sociology.
3231,Sociology of Health,2021-09-22,5119,1067,Japanese,This book explores the sociological aspects of health and illness.
3232,Introduction to Psychology,2018-05-30,5020,1068,French,An overview of the major concepts and theories in psychology.
3233,Cognitive Psychology,2020-11-18,5036,1068,Russian,This book explores the cognitive processes underlying human thought and behavior.
3234,Introduction to Economics,2019-06-25,5089,1069,Japanese,An overview of economic principles and concepts.
3235,Macroeconomics,2021-12-30,5148,1069,Spanish,This book explores the principles of macroeconomics.
3236,Introduction to History,2018-04-12,5107,1070,English,An overview of major historical events and periods.
3237,Modern European History,2020-08-25,5037,1070,Italian,This book explores the history of modern Europe.
3238,Introduction to Chemistry,2018-11-18,5161,1071,Spanish,An overview of the basic principles and concepts in chemistry.
3239,Analytical Chemistry,2021-03-15,5093,1071,Italian,This book explores the principles and techniques of analytical chemistry.
3240,Introduction to Business,2019-02-25,5090,1072,Italian,An introductory text covering the fundamental principles and concepts in business.
3241,Entrepreneurship,2021-06-30,5080,1072,English,This book explores the principles and practices of entrepreneurship.
3242,Introduction to Engineering,2018-07-25,5094,1073,Korean,An introductory text covering the fundamental principles and concepts in engineering.
3243,Mechanical Engineering,2020-11-15,5051,1073,Italian,A detailed exploration of the principles and applications of mechanical engineering.
3244,Introduction to Environmental Science,2019-05-12,5015,1074,Russian,"An introductory book on environmental science, covering ecosystems, biodiversity, and pollution."
3245,Climate Change and Sustainability,2021-09-28,5171,1074,Korean,This book explores the relationship between climate change and sustainable practices.
3246,Introduction to Philosophy,2018-10-10,5133,1075,Hindi,An overview of major philosophical concepts and thinkers from ancient to modern times.
3247,Ethics,2021-02-15,5136,1075,English,A comprehensive guide to the principles and theories of ethics.
3248,Introduction to Political Science,2019-01-18,5006,1076,Hebrew,An introductory text covering the basic concepts and theories in political science.
3249,Comparative Politics,2021-11-22,5143,1076,Hebrew,This book explores the political systems of different countries.
3250,Introduction to Sociology,2019-04-22,5048,1077,Spanish,An introductory book that covers the basic concepts and theories in sociology.
3251,Sociology of Education,2021-07-15,5113,1077,Spanish,This book explores the sociological aspects of education.
3252,Introduction to Psychology,2018-02-10,5020,1078,Hindi,An overview of the major concepts and theories in psychology.
3253,Abnormal Psychology,2020-08-05,5049,1078,Hindi,A comprehensive look at psychological disorders and their treatments.
3254,Introduction to Economics,2019-05-28,5089,1079,Hindi,An overview of economic principles and concepts.
3255,International Economics,2021-09-10,5156,1079,French,This book explores the principles and theories of international economics.
3256,Introduction to History,2018-07-05,5107,1080,English,An overview of major historical events and periods.
3257,American History,2020-10-25,5066,1080,German,This book explores the history of the United States.
3258,Introduction to Chemistry,2018-09-18,5161,1081,Hindi,An overview of the basic principles and concepts in chemistry.
3259,Inorganic Chemistry,2021-02-05,5110,1081,Russian,This book explores the principles and applications of inorganic chemistry.
3260,Introduction to Business,2019-01-25,5090,1082,Japanese,An introductory text covering the fundamental principles and concepts in business.
3261,Business Strategy,2021-08-15,5031,1082,German,This book explores the principles and practices of business strategy.
3262,Introduction to Engineering,2018-07-15,5094,1083,Hindi,An introductory text covering the fundamental principles and concepts in engineering.
3263,Software Engineering,2020-09-22,5142,1083,Japanese,A detailed exploration of the principles and practices of software engineering.
3264,Introduction to Environmental Science,2019-02-12,5015,1084,French,"An introductory book on environmental science, covering ecosystems, biodiversity, and pollution."
3265,Environmental Sustainability,2021-11-18,5072,1084,French,This book explores the principles and practices of environmental sustainability.
3266,Introduction to Art History,2018-10-25,5041,1085,English,"An overview of major periods, movements, and artists in art history."
3267,Art and Society,2021-03-05,5105,1085,Hebrew,This book explores the relationship between art and society.
3268,Learning Python,2019-03-15,5159,1086,Italian,"An introductory book for learning Python programming, covering basics to advanced topics."
3269,Advanced Python Techniques,2021-07-20,5159,1086,Chinese,"This book covers advanced techniques in Python programming, including data structures and algorithms."
3270,Python for Data Science,2020-11-10,5159,1086,English,A comprehensive guide to using Python for data science applications.
3271,Java for Beginners,2018-09-25,5096,1087,English,"An introductory book on Java programming, ideal for beginners."
3272,Java Design Patterns,2020-03-30,5096,1087,Italian,This book explores common design patterns in Java and how to implement them.
3273,Java Concurrency in Practice,2021-11-22,5096,1087,Hebrew,"A detailed guide to concurrency in Java, covering threads, synchronization, and parallelism."
3274,Introduction to C++,2019-02-18,5019,1088,Italian,"An introductory guide to C++ programming, covering basic to intermediate concepts."
3275,Advanced C++ Programming,2020-10-15,5019,1088,Korean,"This book delves into advanced topics in C++ programming, including templates and STL."
3276,C++ for Game Development,2021-06-30,5019,1088,Chinese,"A comprehensive guide to using C++ in game development, covering graphics and physics engines."
3277,JavaScript Basics,2018-05-22,5160,1089,Hindi,"An introductory book on JavaScript programming, ideal for web developers."
3278,Advanced JavaScript,2020-09-12,5160,1089,Japanese,"This book covers advanced JavaScript concepts, including ES6 features and asynchronous programming."
3279,JavaScript for Web Development,2021-12-05,5160,1089,Japanese,A comprehensive guide to using JavaScript for modern web development.
3280,Introduction to Swift,2019-06-10,5055,1090,Japanese,"An introductory guide to Swift programming, ideal for iOS developers."
3281,Advanced Swift Programming,2020-11-22,5055,1090,French,This book covers advanced Swift programming techniques and best practices.
3282,Beginning Ruby,2018-07-18,5009,1091,Spanish,"An introductory book on Ruby programming, perfect for beginners."
3283,Ruby on Rails,2020-03-05,5009,1091,Hindi,A comprehensive guide to building web applications using Ruby on Rails.
3284,Advanced Ruby Programming,2021-08-25,5009,1091,Hebrew,This book covers advanced Ruby programming concepts and techniques.
3285,Introduction to PHP,2019-05-30,5146,1092,Hebrew,"An introductory guide to PHP programming, ideal for web developers."
3286,Advanced PHP Programming,2020-12-15,5146,1092,Korean,This book covers advanced PHP programming techniques and best practices.
3287,Kotlin for Android Developers,2018-11-22,5056,1093,Spanish,A comprehensive guide to using Kotlin for Android app development.
3288,Advanced Kotlin Programming,2020-08-05,5056,1093,Hindi,This book covers advanced Kotlin programming concepts and techniques.
3289,Kotlin for Server-Side Development,2021-11-10,5056,1093,Korean,"A guide to using Kotlin for server-side development, including web and API development."
3290,C# for Beginners,2018-09-30,5172,1094,German,"An introductory guide to C# programming, perfect for beginners."
3291,Advanced C# Programming,2020-04-15,5172,1094,French,This book covers advanced C# programming techniques and best practices.
3292,C# for Web Development,2021-09-25,5172,1094,French,"A guide to using C# for web development, covering ASP.NET and MVC frameworks."
3293,Go Programming Basics,2019-02-25,5054,1095,English,"An introductory guide to Go programming, covering basic to intermediate concepts."
3294,Advanced Go Programming,2020-09-12,5054,1095,Spanish,This book covers advanced Go programming techniques and best practices.
3295,Go for Web Development,2021-11-30,5054,1095,Russian,"A guide to using Go for web development, including web frameworks and RESTful APIs."
3296,Introduction to R,2018-08-15,5144,1096,Russian,"An introductory guide to R programming, ideal for data analysis and statistics."
3297,Advanced R Programming,2020-05-10,5144,1096,French,This book covers advanced R programming techniques and best practices.
3298,R for Data Science,2021-07-22,5144,1096,German,A comprehensive guide to using R for data science applications.
3299,Introduction to Scala,2019-06-25,5067,1097,Hebrew,"An introductory guide to Scala programming, covering basic to intermediate concepts."
3300,Advanced Scala Programming,2020-10-05,5067,1097,Hindi,This book covers advanced Scala programming techniques and best practices.
3301,Dart Programming for Beginners,2019-04-10,5122,1098,German,"An introductory guide to Dart programming, ideal for Flutter developers."
3302,Advanced Dart Programming,2020-11-30,5122,1098,Chinese,This book covers advanced Dart programming techniques and best practices.
3303,Dart and Flutter for Mobile Development,2021-08-25,5122,1098,Spanish,A comprehensive guide to using Dart and Flutter for mobile app development.
3304,Introduction to Rust,2019-07-20,5164,1099,German,"An introductory guide to Rust programming, covering basic to intermediate concepts."
3305,Advanced Rust Programming,2020-12-05,5164,1099,Chinese,This book covers advanced Rust programming techniques and best practices.
3306,Rust for Systems Programming,2021-09-12,5164,1099,Spanish,"A guide to using Rust for systems programming, covering performance and safety."
3307,Introduction to TypeScript,2018-10-25,5101,1100,Hindi,"An introductory guide to TypeScript programming, ideal for JavaScript developers."
3308,Advanced TypeScript Programming,2020-03-22,5101,1100,Spanish,This book covers advanced TypeScript programming techniques and best practices.
3309,TypeScript for Web Development,2021-07-30,5101,1100,German,A comprehensive guide to using TypeScript for modern web development.
3310,Perl Programming Basics,2019-01-15,5106,1101,Chinese,"An introductory guide to Perl programming, covering basic to intermediate concepts."
3311,Advanced Perl Programming,2020-10-05,5106,1101,Russian,This book covers advanced Perl programming techniques and best practices.
3312,Perl for System Administration,2021-08-22,5106,1101,German,A guide to using Perl for system administration tasks.
3313,Introduction to Shell Scripting,2018-11-10,5170,1102,Italian,"An introductory guide to shell scripting, covering basic to intermediate concepts."
3314,Advanced Shell Scripting,2020-06-22,5170,1102,German,This book covers advanced shell scripting techniques and best practices.
3315,Introduction to SQL,2019-03-12,5039,1103,Korean,"An introductory guide to SQL programming, covering basic to intermediate concepts."
3316,Advanced SQL Programming,2020-10-18,5039,1103,Korean,This book covers advanced SQL programming techniques and best practices.
3317,Introduction to HTML and CSS,2018-08-25,5017,1104,Hindi,"An introductory guide to HTML and CSS, ideal for web developers."
3318,Advanced HTML and CSS,2020-04-15,5017,1104,English,This book covers advanced HTML and CSS techniques and best practices.
3319,Responsive Web Design with HTML and CSS,2021-11-30,5017,1104,English,A comprehensive guide to creating responsive web designs using HTML and CSS.
3320,Introduction to SQL,2018-06-15,5039,1105,Russian,"An introductory guide to SQL programming, covering basic to intermediate concepts."
3321,Advanced SQL Queries,2020-09-25,5039,1105,Hindi,This book covers advanced SQL querying techniques and best practices.
3322,Introduction to Python,2019-04-20,5159,1106,Hebrew,"An introductory guide to Python programming, covering basic to intermediate concepts."
3323,Data Analysis with Python,2020-11-10,5159,1106,Korean,This book covers data analysis techniques using Python.
3324,JavaScript for Beginners,2018-08-30,5160,1107,Korean,"An introductory guide to JavaScript programming, ideal for web developers."
3325,JavaScript for Web Development,2020-05-20,5160,1107,Korean,This book covers JavaScript techniques and best practices for modern web development.
3326,Java Programming Basics,2019-03-22,5096,1108,Spanish,"An introductory guide to Java programming, ideal for beginners."
3327,Advanced Java Programming,2020-10-30,5096,1108,Spanish,This book covers advanced Java programming techniques and best practices.
3328,Java for Enterprise Development,2021-12-15,5096,1108,Italian,A comprehensive guide to using Java for enterprise-level application development.
3329,Introduction to C++,2018-11-25,5019,1109,French,"An introductory guide to C++ programming, covering basic to intermediate concepts."
3330,C++ for Game Development,2020-07-05,5019,1109,German,This book covers C++ programming techniques for game development.
3331,Python Programming Basics,2019-02-12,5159,1110,Russian,"An introductory guide to Python programming, covering basic to intermediate concepts."
3332,Python for Data Analysis,2020-10-22,5159,1110,Hebrew,This book covers data analysis techniques using Python.
3333,JavaScript Basics,2018-09-05,5160,1111,Spanish,"An introductory guide to JavaScript programming, ideal for web developers."
3334,JavaScript for Modern Web Development,2020-06-12,5160,1111,Korean,This book covers JavaScript techniques and best practices for modern web development.
3335,Java Basics,2019-04-22,5096,1112,German,"An introductory guide to Java programming, ideal for beginners."
3336,Advanced Java Programming,2020-12-20,5096,1112,Russian,This book covers advanced Java programming techniques and best practices.
3337,Introduction to Swift,2018-10-12,5055,1113,Korean,"An introductory guide to Swift programming, ideal for iOS developers."
3338,Swift for Advanced Developers,2020-07-25,5055,1113,Chinese,This book covers advanced Swift programming techniques and best practices.
3339,Swift for App Development,2021-12-05,5055,1113,Italian,A comprehensive guide to using Swift for iOS app development.
3340,Introduction to Ruby,2019-01-18,5009,1114,Japanese,"An introductory guide to Ruby programming, ideal for beginners."
3341,Ruby for Web Development,2020-09-22,5009,1114,German,This book covers Ruby programming techniques for web development using Ruby on Rails.
3342,Introduction to PHP,2018-08-30,5146,1115,Hebrew,"An introductory guide to PHP programming, ideal for web developers."
3343,Advanced PHP Programming,2020-11-25,5146,1115,Korean,This book covers advanced PHP programming techniques and best practices.
3344,Kotlin Programming Basics,2019-04-18,5056,1116,Korean,"An introductory guide to Kotlin programming, ideal for Android developers."
3345,Advanced Kotlin Programming,2020-12-15,5056,1116,Japanese,This book covers advanced Kotlin programming techniques and best practices.
3346,C# Programming Basics,2019-02-10,5172,1117,English,"An introductory guide to C# programming, covering basic to intermediate concepts."
3347,Advanced C# Programming,2020-10-20,5172,1117,Hebrew,This book covers advanced C# programming techniques and best practices.
3348,Introduction to Go,2019-03-30,5054,1118,Chinese,"An introductory guide to Go programming, covering basic to intermediate concepts."
3349,Advanced Go Programming,2020-11-12,5054,1118,Hindi,This book covers advanced Go programming techniques and best practices.
3350,R Programming Basics,2018-09-20,5144,1119,Spanish,"An introductory guide to R programming, ideal for data analysis and statistics."
3351,Advanced R Programming,2020-05-15,5144,1119,English,This book covers advanced R programming techniques and best practices.
3352,Introduction to Scala,2019-04-12,5067,1120,German,"An introductory guide to Scala programming, covering basic to intermediate concepts."
3353,Advanced Scala Programming,2020-11-05,5067,1120,Spanish,This book covers advanced Scala programming techniques and best practices.
3354,Introduction to Dart,2019-01-15,5122,1121,Italian,"An introductory guide to Dart programming, ideal for Flutter developers."
3355,Advanced Dart Programming,2020-10-25,5122,1121,English,This book covers advanced Dart programming techniques and best practices.
3356,Introduction to Rust,2019-03-05,5164,1122,Russian,"An introductory guide to Rust programming, covering basic to intermediate concepts."
3357,Advanced Rust Programming,2020-11-18,5164,1122,Chinese,This book covers advanced Rust programming techniques and best practices.
3358,Introduction to TypeScript,2018-07-22,5101,1123,English,"An introductory guide to TypeScript programming, ideal for JavaScript developers."
3359,Advanced TypeScript Programming,2020-08-12,5101,1123,Russian,This book covers advanced TypeScript programming techniques and best practices.
3360,Introduction to Perl,2019-05-30,5106,1124,English,"An introductory guide to Perl programming, covering basic to intermediate concepts."
3361,Advanced Perl Programming,2020-11-22,5106,1124,English,This book covers advanced Perl programming techniques and best practices.
